{
  "schema_version": "lnv.collector.dataset.v1",
  "collector": {
    "tech_id": "Lenovo.XCC",
    "module": "LNV.AsBuiltDoc.Lenovo.XCC",
    "entry_point": "Invoke-AsBuiltDoc.Lenovo.XCC"
  },
  "source": {
    "bundle_id": "0634a81a-4d4d-47f8-9ac6-ad28965741e7",
    "bundle_root": "C:\\Github\\LNV.AsBuiltDoc.Core\\out\\412f44d4-06fa-4b1b-b1ea-bd0d7ac07ed8",
    "target_key": "srv05-xcc",
    "file": "datasets/Lenovo.XCC/core/srv05-xcc/host-fc-ports.json"
  },
  "dataset": "host-fc-ports",
  "item_count": 0,
  "items": []
}
